Title,Price,Case Size,Battery Capacity,Brand,Model,Operating System,Storage Capacity,Collection Date
2025 Smart Watch For Men/Women Waterproof Smartwatch Bluetooth iPhone Samsung,$29.99/ea,22 mm,N/A,IOWODO,Smart Bracelet,Android /iOS - Apple,64MB,2025-02-02 17:05:01
CMF by Nothing Watch Pro AMOLED Bluetooth Calling GPS Fitness Smartwatch - New,$69.99,1.96 AMOLED display,N/A,Nothing,Nothing Watch Pro,Android,N/A,2025-02-02 17:05:00
"Google Pixel Watch 2 41mm GPS WiFi Bluetooth Gold, Black, Silver G4TSL",$119.99/ea,41 mm,N/A,Google,Google Pixel Watch 2,Android Wear OS 4,32 GB,2025-02-02 17:05:14
Smartwatch Kids Phone Function GPS Tracker SOS Wristwatch for iPhone Samsung,$82.79,N/A,N/A,N/A,N/A,N/A,N/A,2025-02-02 17:05:01
"Motorola Moto Watch 70 Health & Fitness Tracker Smartwatch, 43mm - Black",$59.99,43mm,N/A,Motorola,MOSWZ70-PB,N/A,N/A,2025-02-02 17:05:05
"2024 Smart Watch For Men/Women, Waterproof Smartwatch Bluetooth iPhone Samsung",$14.99/ea,40 mm,N/A,Willful,N29,Compatible with IOS& Android,128Mb,2025-02-02 17:05:04
TOZO S7 Smart Watch 1.85” Touch Screen Dynamic Dials Fitness Watch Sports 100+,$38.99,47 mm,N/A,TOZO,S7,N/A,N/A,2025-02-02 17:05:05
Samsung Galaxy Gear S SM-R750A Curved Super AMOLED Smart Watch – Black,$23.00,44 mm,N/A,Samsung,Samsung Galaxy Gear,Tizen,N/A,2025-02-02 17:05:02
"2024 Smart Watch For Men/Women, Waterproof Smartwatch Bluetooth iPhone Samsung",$19.79,45 mm,N/A,AICase,T12PRo,N/A,N/A,2025-02-02 17:05:06
Smart Watch Women with Phone Function Wristwatch Watch for iPhone Samsung Huawei,$93.15,N/A,N/A,N/A,N/A,N/A,N/A,2025-02-02 17:05:00
Smart Watch Women Men with Phone Function Wristwatch for iPhone Samsung Huawei,$62.07,N/A,N/A,N/A,N/A,N/A,N/A,2025-02-02 17:05:07
"Smart Watch Women with Phone Function 1.27"" Smart Watch 400 Dials Fitness",$93.15,N/A,N/A,N/A,N/A,N/A,N/A,2025-02-02 17:05:08
Smartwatch With Accessories New!,$20.72,N/A,N/A,N/A,N/A,N/A,N/A,2025-02-02 17:05:04
Military Smart Watch for Men(Answer /Make Call)Rugged Heart Rate Fitness Tracker,$35.99/ea,1.39 Inches,400mAh,Tradinno,Smart Bracelet,Android Wear,Flash 128MB,2025-02-02 17:05:11
Samsung Galaxy Watch 6 Classic 47mm Stainless-Steel Smartwatch w/Fitness Tracker,$124.99,47 mm,N/A,Samsung,Samsung Galaxy Watch6 Classic,Android Wear,N/A,2025-02-02 17:05:07
Smartwatch Men Women with Phone Function Wristwatch for iPhone Samsung Huawei,$62.07,N/A,N/A,N/A,N/A,N/A,N/A,2025-02-02 17:05:01
Bluetooth Smart Watch w/Camera Waterproof Phone Mate For Android Samsung iPhone,$13.99,ONE SIZE,N/A,Unbranded,(new)DZ09,N/A,N/A,2025-02-02 17:05:09
ECG+PPG Bluetooth Call Smart Watch Laser Health Blood Pressure Fitnes Sports,$24.90/ea,47 mm,N/A,ChiBear,Smart Bracelet,"Apple Watch, OS Android Wear",32 GB,2025-02-02 17:05:11
Smart Watch Bluetooth Call Large Screen Heart Rate Pedometer Weather Forecast,$38.50,44 mm,N/A,Unbranded,ZI9,N/A,N/A,2025-02-02 17:05:08
Cartine RIzla Silver Corte Argento Grigie Regol Ultra Sotile Tipo B 100 Libretti,$45.86,x,N/A,RIzla,Cartine Silver Corte Argento Grigie Regol Ultra Sotile Tipo,N/A,N/A,2025-02-02 17:05:07
Smart Watch Men Women with Phone Function Wristwatch Sports Watch for Android IOS,$103.57,N/A,N/A,N/A,N/A,N/A,N/A,2025-02-02 17:05:06
EIGIIS KE3 Smart Watch 3ATM Waterproof Original Design For Men Bluetooth Call,$37.97,36 mm,N/A,watches,watches,N/A,N/A,2025-02-02 17:05:01
Smart Watch T60 Waterproof Fitness Tracker Compatible w/Android & iOS Pack of 11,$149.99,N/A,N/A,Unbranded,T60,N/A,N/A,2025-02-02 17:05:01
"Samsung Galaxy Watch 3 (45mm, GPS, Bluetooth) Smart Watch - Mystic Black",$33.99,45 mm,N/A,Samsung,Samsung Galaxy Watch Active 3,N/A,N/A,2025-02-02 17:05:04
Smart Watch Women with Phone Function Wristwatch Watch for iPhone Samsung Huawei-,EUR 99.90,N/A,N/A,N/A,N/A,N/A,N/A,2025-02-02 17:05:06
Google Pixel Watch 41mm GPS + WiFi + LTE Unlocked Gold Black Silver Watch - Good,$53.99/ea,41 mm,N/A,Google,Google Pixel Watch,Wear OS,32 GB,2025-02-02 17:05:05
"Sk27 Business Smart Watch,1.58'' Full Screen Smart Watch with 3 Wrist Bands",$34.81,/,N/A,Unbranded,does not apply,N/A,N/A,2025-02-02 17:05:02
New Samsung Galaxy Watch 7 40mm (SM-L305U) (WiFi + LTE/Cellular),$183.95/ea,40 mm,N/A,Samsung,Samsung Galaxy Watch 7,Wear OS,32 GB,2025-02-02 17:05:02
Samsung Galaxy Watch5 Pro (LTE) SM-R925U 45mm Titanium Case - Black,$71.99,45 mm,N/A,Samsung,Samsung Galaxy Watch5 Pro,Wear OS,N/A,2025-02-02 17:05:05
"Smart Watch, 1.81"" Touch Screen Smartwatch for Women (Beige and Gold) Fitness...",$17.76/ea,Does not apply,N/A,Yaahoony,Does not apply,N/A,N/A,2025-02-02 17:05:03
2024 DT Watch Ultra 47mm Smartwatch Fitness  Video Player,$63.95,default,N/A,diorena,default,N/A,N/A,2025-02-02 17:05:08
Samsung Galaxy Watch 6 Classic 47mm GPS + WiFi + Bluetooth R960 - Very good,$114.99/ea,47 mm,N/A,Samsung,Samsung Galaxy Watch6 Classic,Wear OS,16 GB,2025-02-02 17:05:16
"2.03"" Larger Screen 4G Smart Watch KOM7 4GB+64GB Heart Rate Monitor Dual Camera",US $118.74,N/A,N/A,N/A,N/A,N/A,N/A,2025-02-02 17:05:04
2024 Smart Watch For Men/Women Waterproof Smartwatch Bluetooth iPhone Samsung,$49.99,40 mm,180 mAh,Unbranded,LS02,Android Wear,other,2025-02-02 17:05:12
Apple Watch Series 3 38mm 42mm GPS + WiFi + Cellular Pink Gold Space Gray Silver,$89.99/ea,"38 mm,42 mm,",N/A,Apple,Apple Watch Series 3,Apple Watch OS,N/A,2025-02-02 17:05:07
Samsung Galaxy Watch Active2 Aluminum 44mm & 40mm Bluetooth R820 & R830,$59.95,N/A,N/A,Samsung,Samsung Galaxy Watch Active 2,Android Wear,N/A,2025-02-02 17:05:12
Smart Watch Men Women Waterproof Heart Rate Bluetooth for iOS Android Samsung,$20.79,44.5(L)*38(W)*11(H)mm,N/A,Unbranded,Smart Bracelet,Android Wear,RAM 512KB+ROM 64KB+Flash 64Mb,2025-02-02 17:05:01
Men Women Smart Watch Bluetooth Smartwatch for Android iPhone Waterproof,$18.48,22 mm,N/A,Unbranded,Smart Watch,N/A,N/A,2025-02-02 17:05:03
Smart Watch Women with Phone Function Diamond Sport Modes Waterproof Pedometer,$113.88,N/A,N/A,N/A,N/A,N/A,N/A,2025-02-02 17:05:01
4G Android Smart Watch 2G RAM+16G ROM GPS WiFi 2In Screen Dual Camera Smartwatch,US $90.99,N/A,N/A,N/A,N/A,N/A,N/A,2025-02-02 17:05:04
Verizon Care Smart Watch Black - New,$29.99,N/A,N/A,Verizon,Verizon Care Smart,N/A,N/A,2025-02-02 17:05:08
"TOZO 5 Smart Watch Answer/Make Call 1.43"" AMOLED 100+ Modes Sport Fitness Watch",US $59.99,N/A,N/A,N/A,N/A,N/A,N/A,2025-02-02 17:05:06
Smart Watch Women Men with Phone Function Wristwatch for iPhone Samsung Huawei,$103.52,N/A,N/A,N/A,N/A,N/A,N/A,2025-02-02 17:05:08
HT22 Smart Watch IP68 Waterproof LED Flashlight GPS Fitness Track Bluetooth Call,$32.75,48.6 mm,450mAh,Unbranded,HT22,No,128MB,2025-02-02 17:05:08
Smart Watch Men Women Waterproof Heart Rate Bluetooth for iOS Android Samsung,US $23.79/ea,N/A,N/A,N/A,N/A,N/A,N/A,2025-02-02 17:05:11
Smartwatch Bluetooth Digital Intelligent Outdoor Sports Pedometer Wrist Watch,AU $40.07,N/A,N/A,N/A,N/A,N/A,N/A,2025-02-02 17:05:03
Smart Watch 1.85-inch  Call Heart Rate Blood Oxygen Multi-sport Waterproof,$53.27,44 mm,N/A,Unbranded,other,N/A,N/A,2025-02-02 17:05:19
"Smart Watch for Women Men, 1.85 Inch Touch Screen Smart Watch with Bluetooth",$103.52,N/A,N/A,N/A,N/A,N/A,N/A,2025-02-02 17:05:02
Michael Kors Gen 4 Genuine Smart Watch Custom Band MKT5046 NP448,$31.00,Dont Know,N/A,Michael Kors,Michael Kors Gen 4,N/A,N/A,2025-02-02 17:05:02
Citizen CZ Smart Gen 2 41MM Black Stainless Steel Casual Smartwatch - MX1005-83X,$149.99,41 mm,N/A,Citizen,013205157714,Wear OS,N/A,2025-02-02 17:05:03
Smartwatch 2024 HD Fitness Watch Women's with Always-On HD Tracker Watch Sports Watch,$113.88,N/A,N/A,N/A,N/A,N/A,N/A,2025-02-02 17:05:07
for Motorola Moto G Play (2024) Military Tactical Fitness Tracker Smart Watch,US $37.99,N/A,N/A,N/A,N/A,N/A,N/A,2025-02-02 17:05:08
Smart Watch Men Women with Phone Function Wristwatch Sports Watch for Android IOS,$103.52,N/A,N/A,N/A,N/A,N/A,N/A,2025-02-02 17:05:08
Smart Watch Kids with Phone Function Wristwatch Smart Watch SOS Sim for Android,$93.15,N/A,N/A,N/A,N/A,N/A,N/A,2025-02-02 17:05:07
"Fitbit Versa 4 Fitness Smartwatch GPS Bluetooth, Waterproof Pink Black",$135.73,40 mm,N/A,FitBit,FB523BKBK,N/A,N/A,2025-02-02 17:05:07
Smart Bracelet Heart Rate Blood Pressure Monitor Pedometer Sports Fitness,$31.59,N/A,N/A,Does not apply,N/A,N/A,N/A,2025-02-02 17:05:02
Classic Tuxedo Filters Filter 6mm Slim Size 20 Bags 120 Filters-,EUR 29.99,N/A,N/A,N/A,N/A,N/A,N/A,2025-02-02 17:05:06
"NEW Huawei Watch GT 5 46mm BROWN 1.43"" AMOLED Bluetooth iOS Android Smartwatch",$275.00,46 mm,N/A,Huawei,Huawei Watch GT 5,N/A,N/A,2025-02-02 17:05:02
"Smart Watch, Stylish Smartwatch, Compatible with iOS Platform, Apple&Android",$65.00/ea,47 mm,N/A,Unbranded,Smart Bracelet,N/A,N/A,2025-02-02 17:05:21
Smart Watch Men Women with Phone Function Wristwatch Sports Watch for Android IOS-,EUR 79.90,N/A,N/A,N/A,N/A,N/A,N/A,2025-02-02 17:05:04
