Title,Price,Case Size,Battery Capacity,Brand,Model,Operating System,Storage Capacity,Collection Date
Elderly Seniors Health Smart Watch Fall Detection Blood pressure Heart Rate New,$82.88,39 mm,N/A,HappyGolden,F800,N/A,N/A,2025-02-05 15:15:03
Men's ECG Watch Sleep Heart Rate Health Blood Pressure Blood Monitor Smart Watch,$51.20,Does not apply,N/A,Unbranded,NORTH EDGE E102,N/A,N/A,2025-02-05 15:15:28
Samsung Galaxy Watch Ultra Titanium Smartwatch 47mm LTE All Colors (US Model),US $359.99,N/A,N/A,N/A,N/A,N/A,N/A,2025-02-05 15:15:01
"LIGE New 1.43"" Bluetooth Call Smartwatch Women Men 466*466 AMOLED Full touch",US $96.22,N/A,N/A,N/A,N/A,N/A,N/A,2025-02-05 15:15:32
"3+32GB 4G SMART WATCH 2.64"" HD Screen,5MP +5MP Dual cameras SIM GPS Android 11.0",$96.00,Large 2.64”,1200mAh,4G Smart Watch,S998 Global Frequency Bands,Android 11.0,32 GB,2025-02-05 15:15:30
Smartwatch Kids Phone Function GPS Tracker SOS Wristwatch for iPhone Samsung,$82.93,N/A,N/A,N/A,N/A,N/A,N/A,2025-02-05 15:15:06
Brand New Samsung Galaxy Watch Ultra 47mm LTE Bluetooth SM-L705U Titanium Gray,$364.99/ea,47 mm,N/A,Samsung,Samsung Galaxy Watch Ultra,Wear OS,32GB,2025-02-05 15:15:05
"2024 Smart Watch For Men/Women, Waterproof Smartwatch Bluetooth iPhone Samsung",$30.00/ea,40 mm,N/A,DESERTCAT,IDW16,Wear OS,64 MB,2025-02-05 15:15:31
Motorola Moto Watch 70 - Health And Fitness Smartwatch For Every Day Wear,US $52.99,N/A,N/A,N/A,N/A,N/A,N/A,2025-02-05 15:15:27
Data Bank Calculator 50 Memory Smart Watch,$14.99,N/A,N/A,Data Bank,50M,N/A,N/A,2025-02-05 15:15:07
Smart Watch with TWS Earbuds Men Smartwatch 2 in1 Wireless Headset for Mobile Phone,$50.84,N/A,N/A,N/A,N/A,N/A,N/A,2025-02-05 15:14:59
"Fire-Boltt Dream, Android Smartwatch 4G LTE SIM, WiFi, 2GB RAM+ 16GB ROM",$179.00,2.02”,N/A,Fire-Boltt,Fire-Boltt Dream,Android,16 GB,2025-02-05 15:15:29
Mijia-Xiaomi Waterproof Smart Watch - Bluetooth Calls-,EUR 32.25,N/A,N/A,N/A,N/A,N/A,N/A,2025-02-05 15:15:00
Fitness Smartwatch Blood Pressure & Oxygen Heart Rate &Sleep Monitor Thermometer,$47.99/ea,N/A,N/A,Unbranded,N/A,N/A,N/A,2025-02-05 15:15:02
Samsung Galaxy Watch Ultra 47MM LTE Unlocked L705U AI Smartwatch - Excellent,US $324.99,N/A,N/A,N/A,N/A,N/A,N/A,2025-02-05 15:15:31
1.5-inch Android Smart Watch HD Camera 2G 3G 4G SIM Card WIFI GPS NFC Smartwatch,$113.54,as the picture,>450mAh,Unbranded,2GB RAM 16GB ROM,N/A,N/A,2025-02-05 15:15:30
Smart Watch Men Women with Phone Function Wristwatch Sports Watch for Android IOS,$72.60,N/A,N/A,N/A,N/A,N/A,N/A,2025-02-05 15:14:59
Yihou Blue fitness Tracker Smartwatch New!,$10.00,44 mm,N/A,Unbranded,Smart Bracelet,N/A,N/A,2025-02-05 15:15:05
LIGE P8 1.69inch HD Screen bluetooth Call Heart Rate Blood Pressure SpO2 Monitor,$27.00,42*38*10mm,N/A,Unbranded,Smart Bracelet,N/A,N/A,2025-02-05 15:15:26
Smartwatch Women Men with Phone Function Wristwatch Sports Watch for Android IOS,$124.44,N/A,N/A,N/A,N/A,N/A,N/A,2025-02-05 15:15:26
New Smart Watch NFC Waterproof Smartwatch Bluetooth for iPhone Android Samsung,$28.99,45.7 mm,260 mAh,Unbranded,NFC Smart Watch,Android Wear,N/A,2025-02-05 15:15:30
Smart Watch Ladies Women with Phone Function Wristwatch for iPhone Samsung Huawei,$82.93,N/A,N/A,N/A,N/A,N/A,N/A,2025-02-05 15:15:03
"NEW Huawei Watch GT 5 46mm BLACK 1.43"" AMOLED Bluetooth iOS Android Smartwatch",$265.00,46 mm,N/A,Huawei,Huawei Watch GT 5,N/A,N/A,2025-02-05 15:15:04
Fitness Smart Watch Activity Tracker Heart Rate For Women Men Oxygen BP Monitor,$7.48,N/A,N/A,Unbranded,N/A,N/A,N/A,2025-02-05 15:15:24
"Motorola Moto Watch 100 GPS Smartwatch for Men & Women, 42mm - Phantom Black-",$52.08,42 mm,N/A,Motorola,Motorola Moto Watch 100,Moto Watch OS,N/A,2025-02-05 15:15:23
"2.88"" Touch Screen 4G Smart Watch 9.0Android/iOS Dual Camera Wristwatch 4GB+64GB",$196.00,Large 2.88”,N/A,HEBS App SmartWatch,S999 Global Frequency Bands,Android Wear,64 GB,2025-02-05 15:15:07
Multifunctional Touchscreen Smart Watch With Call Function Included,$18.10,40 mm,N/A,Unbranded,G20,N/A,N/A,2025-02-05 15:14:58
Raw Organic Hemp Black Natural Long Bio King Size 50 Booklet Cards-,EUR 36.00,N/A,N/A,N/A,N/A,N/A,N/A,2025-02-05 15:15:01
Smart Watch Women Men with Phone Function Wristwatch for iPhone Samsung Huawei,$62.17,N/A,N/A,N/A,N/A,N/A,N/A,2025-02-05 15:15:25
Samsung Galaxy Fit3 SM-R390 Fitness Tracker - 101 Workouts modes - New,$49.99,42.9 mm x 28.8mm x 9.9mm,N/A,Samsung,Samsung Galaxy Fit3,N/A,256MB,2025-02-05 15:15:06
"CMF by Nothing Watch 2 Pro 1.32"" AMOLED GPS Smartwatch New",$79.95,1.3 inch AMOLED display with auto-brightness.,N/A,NOTHING,CMF by Nothing Watch 2 Pro,N/A,N/A,2025-02-05 15:15:00
Smart Watch for Men Women Answer/Make Calls with Blood Pressure Sleep Monitor,$23.39/ea,40 mm,N/A,Unbranded,Smart Bracelet,N/A,N/A,2025-02-05 15:15:28
Smart Watch Women Men with Phone Function Wristwatch for iPhone Samsung Huawei-,EUR 89.90,N/A,N/A,N/A,N/A,N/A,N/A,2025-02-05 15:15:01
NEW  Amazfit Active Edge Smart Watch Mint Green,$57.00,46 mm,N/A,Amazfit,amazfit active edge,N/A,N/A,2025-02-05 15:14:59
"Military Smart Watch, 1.52-Inch Touch Screen Tactical Smartwatch with Text an...",$61.53/ea,Does not apply,N/A,Jdcrsj,Does not apply,N/A,N/A,2025-02-05 15:15:27
"2.03"" Larger Screen 4G Smart Watch KOM7 4GB+64GB Heart Rate Monitor Dual Camera",$118.74,43 mm,800mAh,SERVO,KOM7,Android 8.1,64 GB,2025-02-05 15:15:33
New Health Monitoring ECG Smart Watch with Fitness Tracker,$39.94,1.96,N/A,Unbranded,N/A,N/A,N/A,2025-02-05 15:15:26
Google Pixel Watch 41mm GPS + WiFi + Bluetooth Gold Black Silver Watch Very Good,$55.99/ea,41 mm,N/A,Google,Google Pixel Watch,Wear OS,32 GB,2025-02-05 15:15:32
Smart Watch Men with Phone Function LED Flashlight Waterproof Sleep Tracker,$145.20,N/A,N/A,N/A,N/A,N/A,N/A,2025-02-05 15:15:25
"Google Pixel Watch 2 41mm GPS WiFi Bluetooth Gold, Black, Silver G4TSL",$119.99/ea,41 mm,N/A,Google,Google Pixel Watch 2,Android Wear OS 4,32 GB,2025-02-05 15:15:28
"2025 Smart Watch For Men, Bluetooth Call 2.01"" Smartwatch for iPhone Samsung",$32.39/ea,55mmx44.5mmx13.5mm,900MAH,IOWODO,Sports Fitness Tracker,Android Wear,128MB,2025-02-05 15:15:02
"Huawei Watch GT 5 Pro 46mm BLACK 1.43"" iOS Android Smartwatch [FREE Earbuds X5]",GBP 280.00,N/A,N/A,N/A,N/A,N/A,N/A,2025-02-05 15:14:59
"CMF by Nothing Watch 2 Pro 1.32"" AMOLED GPS Smartwatch New",US $79.95,N/A,N/A,N/A,N/A,N/A,N/A,2025-02-05 15:15:30
Military Smart Watch for Men(Answer/Make Calls) Rugged Tactical Fitness Tracker,US $29.99/ea,N/A,N/A,N/A,N/A,N/A,N/A,2025-02-05 15:15:01
Bluetooth 5.0 Smart Watch Heart Rate Blood Pressure Oxygen Waterproof Bracelet,$28.60,N/A,N/A,N/A,N/A,N/A,N/A,2025-02-05 15:15:28
Raw Black Ultra Thin Pure Paper Cards King Size 50 Booklets-,EUR 42.50,N/A,N/A,N/A,N/A,N/A,N/A,2025-02-05 15:15:31
Smart Watch Women Men with Phone Function Wristwatch for iPhone Samsung Huawei,$124.44,N/A,N/A,N/A,N/A,N/A,N/A,2025-02-05 15:15:24
New In box Sealed Brand: Williben (84)Smart Watch(Answer/Dial Calls),$40.00,46 mm,N/A,Unbranded,84,N/A,N/A,2025-02-05 15:15:02
"Steel 1.39"" Bluetooth Call Smart Watch Men Sports Fitness IP67 Waterproof",US $36.62,N/A,N/A,N/A,N/A,N/A,N/A,2025-02-05 15:15:06
"Xplora X5 Play, 4G GPS, Smartwatch for Kids - New",$79.95,145 - 210mm (wrist size),N/A,Xplora,Xplora X5,Android,4 GB,2025-02-05 15:15:31
smart watch samsung,$100.00,40 mm,N/A,Unbranded,Smart Bracelet,Android Wear,N/A,2025-02-05 15:14:58
Samsung Galaxy Gear S SM-R750 Curved Super AMOLED Smart Watch -Universal strap,$99.95,44 mm,N/A,Samsung,Samsung Galaxy Gear,Tizen,N/A,2025-02-05 15:15:29
NEW I1S Smart Watch 4G SIM Card 1.9inch HD Screen with GPS WIFI Dual Camera,$73.49,36 mm,N/A,watches,watches,N/A,N/A,2025-02-05 15:14:56
CARBINOX Titan Smartwatch IP69K Waterproof Rugged Smart Watch NEW SEALED BOX,$47.00,45 mm,N/A,Titan,Carbinox titan,N/A,N/A,2025-02-05 15:15:29
Smart Watch Men Women with Phone Function Wristwatch Sports Watch for Android IOS,$93.36,N/A,N/A,N/A,N/A,N/A,N/A,2025-02-05 15:15:30
"NEW Smartwatch - Count Calories, Steps, and Distance - Black - Android Bluetooth",$19.99,38 mm,N/A,Unbranded,Smart Bracelet,N/A,N/A,2025-02-05 15:15:00
Smart Watch Y68 Real Step Count Sports Watch Fashion Fitness Tracker,$20.75,N/A,N/A,N/A,N/A,N/A,N/A,2025-02-05 15:15:30
"Smart Watch, 1.81"" Touch Screen Smartwatch for Women (Beige and Gold) Fitness...",$17.76/ea,Does not apply,N/A,Yaahoony,Does not apply,N/A,N/A,2025-02-05 15:15:05
OCB PREMIUM BLACK LONG BLACK KING SIZE CARDS AND PAPER FILTERS 16 BOOKLETS,$28.02,N/A,N/A,N/A,N/A,N/A,N/A,2025-02-05 15:15:27
Samsung Galaxy Watch 7 40mm GPS + WiFi + Cellular Unlocked L305 - Excellent,$172.99/ea,40 mm,N/A,Samsung,Samsung Galaxy Watch 7,Wear OS,32 GB,2025-02-05 15:15:07
Smart Watch 2024 LT10  Android Bluetooth Call Touch Dial Music Fitness tracker,$18.70,43 mm,N/A,Unbranded,LT10,N/A,N/A,2025-02-05 15:15:05
Apple Watch Series 5 44mm Gps Stainless Steel  + Band  32GB - Excellent,$119.00,44 mm,N/A,Apple,Apple Watch Series 5,Apple Watch OS,32 GB,2025-02-05 15:14:59
Smart Watch Heart Rate Blood Pressure Fitness Monitor Waterproof Bluetooth Watch,$21.99/ea,38 mm,N/A,AICase,Smart Bracelet,I Band,32M,2025-02-05 15:15:04
Gizeh Extra Slim Filters 5.3mm Smooth Sponge Filter 20 Bags 150 Filters,$32.17,N/A,N/A,N/A,N/A,N/A,N/A,2025-02-05 15:15:08
Smartwatch Women Men with Phone Function Sports Watch Wristwatch for Android IOS-,EUR 159.90,N/A,N/A,N/A,N/A,N/A,N/A,2025-02-05 15:15:04
Google Pixel Watch 3 - 45mm (LTE + Bluetooth) - Matte Black,US $289.98,N/A,N/A,N/A,N/A,N/A,N/A,2025-02-05 15:15:02
SMARTWATCH 116 PLUS UNISEX MULTIFUNCTION WATCH GIFT IDEA MEN WOMEN,$13.39,N/A,N/A,N/A,N/A,N/A,N/A,2025-02-05 15:15:27
Smart Watch Men Women with Phone Function Wristwatch Sports Watch for Android IOS,$103.69,N/A,N/A,N/A,N/A,N/A,N/A,2025-02-05 15:15:00
Smart Watch Men Women for Android iOS Fitness Watch Heart Rate Monitor Pedometer Gold,$93.31,N/A,N/A,N/A,N/A,N/A,N/A,2025-02-05 15:15:32
"TOZO 4 Smart Watch 1.78"" AMOLED Touch Screen Bluetooth 5.3 Fitness Tracker",$38.99,45 mm,N/A,TOZO,S4,N/A,N/A,2025-02-05 15:15:29
Smartwatch Men Women with Phone Function Wristwatch for iPhone Samsung Huawei,$155.58,N/A,N/A,N/A,N/A,N/A,N/A,2025-02-05 15:15:25
HAYLOU Watch S8 Smart Watch 1.96'' AMOLED Curved Screen Smartwatch Bluetooth Cal,$44.49,1.96'',N/A,Haylou,S8,N/A,N/A,2025-02-05 15:15:05
Smart Watch Bluetooth Call Sports Fitness Tracker Heart Rate Waterproof watches,$35.22,1.39 inches,N/A,Unbranded,Smart Wristband,N/A,N/A,2025-02-05 15:15:25
Smartwatch Men Women with Phone Function Wristwatch for iPhone Samsung Huawei,$82.93,N/A,N/A,N/A,N/A,N/A,N/A,2025-02-05 15:15:30
Fitbit Charge 3 Fitness Activity Tracker Heart Rate Monitor Smartwatch more colo,$56.99,N/A,N/A,Fitbit,Fitbit Charge 3,N/A,N/A,2025-02-05 15:15:31
2024 Smart Watch Android iOS Bluetooth For Men/Women Fitness Watch Waterproof US,$45.99,44 mm,N/A,Unbranded,G50,None,N/A,2025-02-05 15:15:02
Smartwatch Men's Phone Function Wristwatch Watch for iPhone Samsung Huawei Tab,$62.22,N/A,N/A,N/A,N/A,N/A,N/A,2025-02-05 15:15:32
Samsung Watch 7 40mm SM-L30DNZGDXAA Green Brand New & Sealed Ships Fast!,$179.99,40 mm,N/A,Samsung,Watch7,Wear OS,N/A,2025-02-05 15:15:27
Smartwatch Women Men Screen: TFT 1.69 inch 240*280 color black,$19.68,N/A,N/A,N/A,N/A,N/A,N/A,2025-02-05 15:15:00
"Smart Watch for Men(Answer/Dial Calls), 5ATM Waterproof, 1.96'HD Rugged Tactical",US $15.88,N/A,N/A,N/A,N/A,N/A,N/A,2025-02-05 15:15:32
Mijia-Xiaomi Bluetooth Watch and Earphone Pack,$26.98,N/A,N/A,N/A,N/A,N/A,N/A,2025-02-05 15:15:29
Smart Watch for Android Men Make/Receive Call Fitness Tracker Watch for Samsung,$32.79/ea,22 mm,N/A,IOWODO,R60,Compatible with Andriod & iOS,0,2025-02-05 15:15:31
Apple Watch Series 3 38mm 42mm GPS + WiFi + Bluetooth Gold Gray Silver - Good,$89.99/ea,"38 mm,42 mm,",N/A,Apple,Apple Watch Series 3,Apple Watch OS,N/A,2025-02-05 15:15:03
Men Smart Watch Bluetooth Stainless Steel Stylish Design Rate Monitoring Blue,$39.00,44 mm,N/A,ALLOYSEED,AW12,N/A,N/A,2025-02-05 15:14:56
"Manike KM60 Smartwatch, 1.43"" Display, Heart Rate, SpO2, IP67 Waterproof-",EUR 69.99,N/A,N/A,N/A,N/A,N/A,N/A,2025-02-05 15:14:59
"Smart Watch GPS Alexa Built-in 1.85"" Smartwatch for Men Women (Answer/Make Call)",$24.99,1.85 Inches,N/A,VPSTAY,Smart watch,Android Wear,128 MB,2025-02-05 15:15:06
"Samsung Galaxy Watch 3 (45mm, GPS, Bluetooth) Smart Watch - Mystic Black",US $33.99,N/A,N/A,N/A,N/A,N/A,N/A,2025-02-05 15:15:03
G7 Max + Smart Watch Color Gun NFC Heart Rate Monitoring AI Voice,$62.39,40 mm,N/A,G7 Max,G7 MAX +,N/A,N/A,2025-02-05 15:15:32
Suunto 9 PEAK PRO All Black Smartwatch 43 mm,$200.00,43 mm,N/A,Suunto,7641717,N/A,N/A,2025-02-05 15:15:04
