title,Price,Brand,Memory Size,Memory Type,Chipset/GPU Model,Connectors,Collection Date
ZEBRONICS NVIDIA ZEB-GT610 2 GB DDR3 Graphics Card,16.2,ZEBRONICS,2.0,DDR3,ZEB-GT610,HDMI,2025-01-29 02:36:26
ZOTAC NVIDIA GeForce RTX 3060 Twin Edge 12 GB GDDR6 Gra...,286.73,ZOTAC,12.0,GDDR6,GeForce RTX 3060 Twin Edge,Unknown,2025-01-29 02:36:26
Colorful NVIDIA GT-1050 4 GB DDR5 Graphics Card,234.93,Colorful,4.0,DDR5,GT-1050,"HDMI, DVI",2025-01-29 02:36:26
JieShuo AMD Radeon RX 590 8 GB GDDR5 Graphics Card,127.7,JieShuo,8.0,GDDR5,RX 590,HDMI,2025-01-29 02:36:26
ZEBRONICS NVIDIA GT730 4 GB DDR3 Graphics Card,33.11,ZEBRONICS,4.0,DDR3,GT730,"HDMI, DVI",2025-01-29 02:36:26
Xsentuals NVIDIA PCIe Riser Adapter Card VER009S / 009S...,5.17,Xsentuals,16.0,GDDR4,"PCIe Riser Adapter Card VER009S / 009S Black & Gold 16x to 1x 60cm USB 3.0 Extension Cable - GPU Riser Adapter - Mining Bitcoin, Ethereum ETH Zcash ZEC Monero XMR",Unknown,2025-01-29 02:36:26
mytechvision AMD Radeon AMD RADEON 8 GB GDDR5 Graphics ...,130.11,mytechvision,8.0,GDDR5,AMD RADEON,Unknown,2025-01-29 02:36:26
mytechvision AMD Radeon RX 580 8 GB GDDR6 Graphics Card,124.08,mytechvision,8.0,GDDR6,RX 580,Unknown,2025-01-29 02:36:26
JieShuo AMD Radeon RX 5500XT 8 GB GDDR5 Graphics Card,179.51,JieShuo,8.0,GDDR5,RX 5500XT,HDMI,2025-01-29 02:36:26
GIGABYTE NVIDIA GV-N3050WF2OC-6GD GeForce RTX 3050 WIND...,216.75,GIGABYTE,6.0,GDDR6,GV-N3050WF2OC-6GD GeForce RTX 3050 WINDFORCE OC,Unknown,2025-01-29 02:36:26
GIGABYTE NVIDIA GV-N3050WF2OC-6GD GeForce RTX 3050 WIND...,216.75,GIGABYTE,6.0,GDDR6,GV-N3050WF2OC-6GD GeForce RTX 3050 WINDFORCE OC,Unknown,2025-01-29 02:36:57
ZOTAC NVIDIA GeForce GT 1030 2 GB DDR5 Graphics Card,87.51,ZOTAC,2.0,DDR5,GeForce GT 1030,Unknown,2025-01-29 02:36:57
MSI NVIDIA GeForce GT 710 2 GB DDR3 Graphics Card,50.0,MSI,2.0,DDR3,GeForce GT 710,HDMI,2025-01-29 02:36:57
ZEBRONICS NVIDIA Zeb GT 730 4 GD3 4 GB DDR3 Graphics Ca...,32.42,ZEBRONICS,4.0,DDR3,Zeb GT 730 4 GD3,Unknown,2025-01-29 02:36:57
gigabtye NVIDIA ?GV-N4060AORUS E-8GD 8 GB GDDR6 Graphic...,462.8,gigabtye,8.0,GDDR6,?GV-N4060AORUS E-8GD,Unknown,2025-01-29 02:36:57
ZEBRONICS NVIDIA ZEBGT730 4 GB GDDR3 Graphics Card,39.14,ZEBRONICS,4.0,GDDR3,ZEBGT730,Unknown,2025-01-29 02:36:57
Colorful NVIDIA Battle AX Mainstream 8 GB GDDR6 Graphic...,469.88,Colorful,8.0,GDDR6,Battle AX Mainstream,Unknown,2025-01-29 02:36:57
ZOTAC NVIDIA GeForce GT 730 4GB Zone Edition 4 GB DDR3 ...,87.51,ZOTAC,4.0,DDR3,GeForce GT 730 4GB Zone Edition,Unknown,2025-01-29 02:36:57
Jack and Rex NVIDIA NGFF M.2 M key to USB 3.0 Adapter C...,3.0,Jack and Rex,1.0,DDR2,NGFF M.2 M key to USB 3.0 Adapter Card Extender M2 to USB3.0 Adapter Converter for PCI-E Riser Card Graphics GPU Mining Miner Package ships in Anti-electrostatic bags to prevent damage.,Unknown,2025-01-29 02:36:57
ZOTAC NVIDIA GeForce GT 710 2 GB DDR3 Graphics Card,40.83,ZOTAC,2.0,DDR3,GeForce GT 710,"HDMI, DVI",2025-01-29 02:36:57
"Zorbes NVIDIA Graphics Card Bracket, GPU Stand,Graphics...",7.16,Zorbes,1.0,DDR3,"Graphics Card Bracket, GPU Stand,Graphics Card GPU Brace",Unknown,2025-01-29 02:37:26
Nextron NVIDIA GT730 4GB DDR3 4 GB DDR3 Graphics Card,6.7,Nextron,4.0,DDR3,GT730 4GB DDR3,Unknown,2025-01-29 02:37:26
ZEBRONICS NVIDIA Gt610 2Gb graphics card 2 GB DDR3 Grap...,17.35,ZEBRONICS,2.0,DDR3,Gt610 2Gb graphics card,Unknown,2025-01-29 02:37:26
ASRock AMD Radeon RX6800XT PGD 16 GB GDDR6 Graphics Car...,1144.57,ASRock,16.0,GDDR6,RX6800XT PGD,HDMI,2025-01-29 02:37:26
Piplus NVIDIA VER012 Pro 10 Capacitor Pcie Riser Extens...,21.94,Piplus,16.0,GDDR4,VER012 Pro 10 Capacitor Pcie Riser Extension Adapter Card ETH Mining,Unknown,2025-01-29 02:37:26
MSI NVIDIA GeForce RTX 3050 VENTUS 2X E 6G OC 6 GB GDDR...,240.95,MSI,6.0,GDDR6,GeForce RTX 3050 VENTUS 2X E 6G OC,Unknown,2025-01-29 02:37:26
MSI NVIDIA GeForce RTX 4090 VENTUS 3X E 24G OC 24 GB GD...,3402.4,MSI,24.0,GDDR6,GeForce RTX 4090 VENTUS 3X E 24G OC,Unknown,2025-01-29 02:37:26
ZEBRONICS NVIDIA ZEB GT730 4 GB GDDR3 Graphics Card,33.72,ZEBRONICS,4.0,GDDR3,ZEB GT730,Unknown,2025-01-29 02:37:26
Nextar NVIDIA VER 009S Riser Cable Black PCIE Riser 1X ...,7.04,Nextar,16.0,GDDR4,"VER 009S Riser Cable Black PCIE Riser 1X to 16X Graphics Extension for GPU Mining Powered Riser Adapter Card, 60cm USB 3.0 Cable, 4 Solid Capacitors, Two 6PIN & Molex 3 Power Options(Pack 0f 1)",Unknown,2025-01-29 02:37:26
"Mebako NVIDIA PCI Express Riser Card V014 Pro, GPU Rise...",10.87,Mebako,2.0,DDR2,"PCI Express Riser Card V014 Pro, GPU Riser Adapter Card PCIE X1 to X16 Extender",Unknown,2025-01-29 02:37:26
MSI AMD Radeon Radeon RX 6600 XT MECH 2X 8G OCV1 8 GB G...,433.72,MSI,8.0,GDDR6,Radeon RX 6600 XT MECH 2X 8G OCV1,Unknown,2025-01-29 02:37:54
AMD AMD Radeon RX 6600 8 GB GDDR6 Graphics Card,437.45,AMD,8.0,GDDR6,RX 6600,HDMI,2025-01-29 02:37:54
MSI NVIDIA GeForce GTX 1650 D6 VENTUS XS OC 4 GB GDDR6 ...,224.08,MSI,4.0,GDDR6,GeForce GTX 1650 D6 VENTUS XS OC,Unknown,2025-01-29 02:37:54
ASUS AMD/ATI TUF Gaming Radeon RX 7900 XT OC Edition 20...,974.69,ASUS,20.0,GDDR6,TUF Gaming Radeon RX 7900 XT OC Edition,HDMI,2025-01-29 02:37:54
Inno3D NVIDIA GEFORCE RTX 4070 SUPER TWIN X2 12 GB GDDR...,707.1,Inno3D,12.0,GDDR6X,GEFORCE RTX 4070 SUPER TWIN X2,Unknown,2025-01-29 02:37:54
GIGABYTE AMD Radeon GV-R69XTGAMING OC-16GD 16 GB GDDR6 ...,1686.73,GIGABYTE,16.0,GDDR6,GV-R69XTGAMING OC-16GD,HDMI,2025-01-29 02:37:54
ZOTAC NVIDIA GAMING GeForce RTX 4070 Ti Trinity OC Whit...,981.92,ZOTAC,12.0,GDDR6X,GAMING GeForce RTX 4070 Ti Trinity OC White Edition,Unknown,2025-01-29 02:37:54
Enter NVIDIA E-GT610-2GD3 PCI Express 2.0 Graphics Card...,22.89,Enter,2.0,DDR3,E-GT610-2GD3 PCI Express 2.0 Graphics Card 64 bit 2GB HDMI VGA,HDMI,2025-01-29 02:37:54
gigabtye NVIDIA ?GV-N4060GAMING OC-8GD 8 GB GDDR6 Graph...,385.49,gigabtye,8.0,GDDR6,?GV-N4060GAMING OC-8GD,Unknown,2025-01-29 02:37:54
MSI NVIDIA RTX 3090 VENTUS 24 GB GDDR6X Graphics Card,2469.87,MSI,24.0,GDDR6X,RTX 3090 VENTUS,Unknown,2025-01-29 02:37:54
MSI AMD Radeon Radeon RX 6700 XT MECH 2X 12G OC 12 GB G...,927.7,MSI,12.0,GDDR6,Radeon RX 6700 XT MECH 2X 12G OC,Unknown,2025-01-29 02:38:21
ZOTAC NVIDIA GEFORCE RTX 4070 AMP AIRO 12 GB GDDR6X Gra...,764.45,ZOTAC,12.0,GDDR6X,GEFORCE RTX 4070 AMP AIRO,Unknown,2025-01-29 02:38:21
nVIDIA NVIDIA RTX3070 8 GB GDDR6 Graphics Card,1022.89,nVIDIA,8.0,GDDR6,RTX3070,Unknown,2025-01-29 02:38:21
ZOTAC NVIDIA RTX 3080 Ti Trinity OC 12 GB GDDR6X Graphi...,1168.66,ZOTAC,12.0,GDDR6X,RTX 3080 Ti Trinity OC,Unknown,2025-01-29 02:38:21
ZOTAC NVIDIA GAMING GEFORE RTX 3050 ECO SOLO 8 GB GDDR6...,249.84,ZOTAC,8.0,GDDR6,GAMING GEFORE RTX 3050 ECO SOLO,Unknown,2025-01-29 02:38:21
MSI NVIDIA GeForce RTX 3080 GAMING Z TRIO 12G LHR 12 GB...,1265.05,MSI,12.0,GDDR6X,GeForce RTX 3080 GAMING Z TRIO 12G LHR,Unknown,2025-01-29 02:38:21
MSI AMD Radeon RX 6700 XT 12 GB GDDR6 Graphics Card,927.7,MSI,12.0,GDDR6,RX 6700 XT,HDMI,2025-01-29 02:38:21
GALAX GeForce Nvidia NVIDIA RTX 3080 SG 10 GB GDDR6 Gra...,978.31,GALAX GeForce Nvidia,10.0,GDDR6,RTX 3080 SG,Unknown,2025-01-29 02:38:21
GIGABYTE AMD Radeon GV-R65XTEAGLE-4GD 4 GB GDDR6 Graphi...,283.12,GIGABYTE,4.0,GDDR6,GV-R65XTEAGLE-4GD,HDMI,2025-01-29 02:38:21
ZOTAC NVIDIA RTX 4070 Ti AMP AIRO Spider-Man: Across Th...,981.92,ZOTAC,12.0,GDDR6,RTX 4070 Ti AMP AIRO Spider-Man: Across The Spider-Verse Bundle,Unknown,2025-01-29 02:38:21
MSI NVIDIA GeForce RTX 4070 Ti SUPER 16G GAMING X SLIM ...,1183.12,MSI,16.0,GDDR6,GeForce RTX 4070 Ti SUPER 16G GAMING X SLIM,Unknown,2025-01-29 02:38:46
MSI NVIDIA GeForce RTX 3060 VENTUS 2X 12G OC 12 GB GDDR...,361.43,MSI,12.0,GDDR6,GeForce RTX 3060 VENTUS 2X 12G OC,Unknown,2025-01-29 02:38:46
ZOTAC NVIDIA RTX 3060 AMP White Edition 12 GB GDDR6 Gra...,392.88,ZOTAC,12.0,GDDR6,RTX 3060 AMP White Edition,Unknown,2025-01-29 02:38:46
Sapphire AMD/ATI 11322-02-20G 24 GB GDDR6 Graphics Card,1216.86,Sapphire,24.0,GDDR6,11322-02-20G,Unknown,2025-01-29 02:38:46
MSI NVIDIA GeForce RTX 4070 Ti SUPER 16G VENTUS 3X OC 1...,1122.28,MSI,16.0,GDDR6,GeForce RTX 4070 Ti SUPER 16G VENTUS 3X OC,Unknown,2025-01-29 02:38:46
MSI NVIDIA GeForce RTX 3080 VENTUS 3X PLUS 12G OC LHR 1...,1421.67,MSI,12.0,GDDR6X,GeForce RTX 3080 VENTUS 3X PLUS 12G OC LHR,Unknown,2025-01-29 02:38:46
Xsentuals NVIDIA STC PCIe Riser Adapter VER 008S PCI-E ...,5.41,Xsentuals,16.0,GDDR4,STC PCIe Riser Adapter VER 008S PCI-E 16x to 1x 60 cm USB 3.0 Extension Cable and 4 Pin 6 PinB-SATA Power -Ethereum Mining ETH,Unknown,2025-01-29 02:38:46
mytechvision AMD Radeon RX 580 8 GB GDDR5 Graphics Card,136.13,mytechvision,8.0,GDDR5,RX 580,Unknown,2025-01-29 02:38:46
LipiWorld NVIDIA Pack Of 2 VER011-PRO Riser Card 10 Cap...,13.6,LipiWorld,16.0,GDDR4,Pack Of 2 VER011-PRO Riser Card 10 Capacitors PCI-E 1X to 16X,Unknown,2025-01-29 02:38:46
Colorful NVIDIA COLORFULGT1030-4G-V 4 GB GDDR4 Graphics...,33.61,Colorful,4.0,GDDR4,COLORFULGT1030-4G-V,Unknown,2025-01-29 02:38:46
JieShuo AMD Radeon RX 580 White RGB 8 GB GDDR5 Graphics...,124.08,JieShuo,8.0,GDDR5,RX 580 White RGB,HDMI,2025-01-29 02:39:14
HANNEA NVIDIA PCI-E PCI Express 3.0 X4 to NVME M.2 NVME...,6.7,HANNEA,16.0,DDR3,PCI-E PCI Express 3.0 X4 to NVME M.2 NVME to NVME SSD PCI-e,Unknown,2025-01-29 02:39:14
JieShuo AMD Radeon RX 5500XT 8 GB GDDR5 Graphics Card,179.51,JieShuo,8.0,GDDR5,RX 5500XT,HDMI,2025-01-29 02:39:14
Sapphire AMD/ATI 11335-04-20G 12 GB GDDR6 Graphics Card,498.18,Sapphire,12.0,GDDR6,11335-04-20G,Unknown,2025-01-29 02:39:14
MSI NVIDIA GeForce RTX 4070 SUPER 12G GAMING SLIM World...,957.82,MSI,12.0,GDDR6,GeForce RTX 4070 SUPER 12G GAMING SLIM World of Warcraft EDITION,Unknown,2025-01-29 02:39:14
Geforce NVIDIA 3070 Ti 8 GB GDDR6X Graphics Card,722.89,Geforce,8.0,GDDR6X,3070 Ti,Unknown,2025-01-29 02:39:14
Geforce NVIDIA 1650 4 GB GDDR6X Graphics Card,722.89,Geforce,4.0,GDDR6X,1650,Unknown,2025-01-29 02:39:14
MSI NVIDIA GeForce RTX 4070 SUPER 12G GAMING X SLIM MLG...,1071.07,MSI,12.0,GDDR6,GeForce RTX 4070 SUPER 12G GAMING X SLIM MLG,Unknown,2025-01-29 02:39:14
Verilux Intel PCI-E PCI Express 3.0 X4 to NVME M.2 NVME...,5.67,Verilux,1.0,DDR3,PCI-E PCI Express 3.0 X4 to NVME M.2 NVME to NVME SSD PCI-e 3.0 x 4 Host Control,Unknown,2025-01-29 02:39:14
MSI NVIDIA GeForce RTX 4070 SUPER 12G GAMING DUKE 3X 12...,878.3,MSI,12.0,GDDR6,GeForce RTX 4070 SUPER 12G GAMING DUKE 3X,Unknown,2025-01-29 02:39:14
MSI NVIDIA GeForce RTX 4070 SUPER 12G VENTUS 2X WHITE O...,879.51,MSI,12.0,GDDR6,GeForce RTX 4070 SUPER 12G VENTUS 2X WHITE OC,Unknown,2025-01-29 02:39:38
NexLens AMD/ATI 3D VR Headset | Virtual Reality Glasses...,6.7,NexLens,2.0,DDR2,3D VR Headset | Virtual Reality Glasses for Interactive Gaming & Video,"HDMI, DVI",2025-01-29 02:39:38
Jack and Rex NVIDIA NGFF M.2 M key to USB 3.0 Adapter C...,3.0,Jack and Rex,1.0,DDR2,NGFF M.2 M key to USB 3.0 Adapter Card Extender M2 to USB3.0 Adapter Converter for PCI-E Riser Card Graphics GPU Mining Miner Package ships in Anti-electrostatic bags to prevent damage.,Unknown,2025-01-29 02:39:38
MSI NVIDIA GT 710 2GD3H LP DDR3 Gaming Graphic Card 2 G...,60.25,MSI,2.0,DDR3,GT 710 2GD3H LP DDR3 Gaming Graphic Card,Unknown,2025-01-29 02:39:38
LipiWorld NVIDIA (Pack Of 6) VER012-PRO Riser Card 10 C...,36.13,LipiWorld,16.0,GDDR4,(Pack Of 6) VER012-PRO Riser Card 10 Capacitors PCI-E 1X to 16X V012 Riser Card,Unknown,2025-01-29 02:39:38
microware NVIDIA PCIe Converter Riser Card PCI-E 1 To 6...,24.08,microware,1.0,GDDR6X,PCIe Converter Riser Card PCI-E 1 To 6 External 16X Slot USB 3.0 for BT Mining,Unknown,2025-01-29 02:39:38
Tobo NVIDIA ER010S Plus USB 3.0 PCI-E Riser VER 010S Pl...,6.51,Tobo,1.0,DDR2,ER010S Plus USB 3.0 PCI-E Riser VER 010S Plus Express 1X to 16X Extender Pcie Riser Adapter Card SATA 6 LED Light,Unknown,2025-01-29 02:39:38
Xsentuals NVIDIA PCI-E 1x to 16x Adapter Card USB3.0 Da...,4.81,Xsentuals,16.0,GDDR4,PCI-E 1x to 16x Adapter Card USB3.0 Data Cable Power Cable Kit Mining Card,Unknown,2025-01-29 02:39:38
Etzin NVIDIA NVIDIA M.2 to PCI-E X16 Slot Adapter Card(...,5.34,Etzin,1.0,DDR2,NVIDIA M.2 to PCI-E X16 Slot Adapter Card(EPL-409HS),Unknown,2025-01-29 02:39:38
Nextar NVIDIA VER 009S Riser Cable Black PCIE Riser 1X ...,7.04,Nextar,16.0,GDDR4,"VER 009S Riser Cable Black PCIE Riser 1X to 16X Graphics Extension for GPU Mining Powered Riser Adapter Card, 60cm USB 3.0 Cable, 4 Solid Capacitors, Two 6PIN & Molex 3 Power Options(Pack 0f 1)",Unknown,2025-01-29 02:39:38
Jack and Rex NVIDIA JAR-VER012X PLUS VER012X PLUS / 012...,6.01,Jack and Rex,1.0,DDR2,JAR-VER012X PLUS VER012X PLUS / 012X / 4 Bigger Capacitor / 16x to 1x Power PCIe Riser Adapter 80cm USB 3.0 Cable,Unknown,2025-01-29 02:40:05
microware NVIDIA PCI-E 1 to 7 Riser Card Riser Heat Sin...,26.07,microware,1.0,GDDR6X,PCI-E 1 to 7 Riser Card Riser Heat Sink Converter for Video Card BTC Mining,Unknown,2025-01-29 02:40:05
Inno3D NVIDIA GEFORCE RTX 3060 TI ITWIN X2 LHR 8 GB GDD...,499.99,Inno3D,8.0,GDDR6,GEFORCE RTX 3060 TI ITWIN X2 LHR,Unknown,2025-01-29 02:40:05
MSI NVIDIA GeForce RTX 4070 Ti SUPER 16G VENTUS 2X OC 1...,1084.33,MSI,16.0,GDDR6,GeForce RTX 4070 Ti SUPER 16G VENTUS 2X OC,Unknown,2025-01-29 02:40:05
